
[32m[I 2024-05-20 19:01:33,500][39m A new study created in memory with name: no-name-a7fc2ce3-47e5-4d60-8676-59172cc9cdb3
(1797, 64)
(1797,)
score:  0.9488888888888889 balanced_acc:  0.9498355840232581 precision:  0.9496564737684354 recall:  0.9498355840232581
(1797, 64)
(1797,)
[32m[I 2024-05-20 19:01:36,687][39m Trial 0 finished with value: 0.9498355840232581 and parameters: {'penality': 'l1', 'inverse_of_regularization_strength': 0.4556745737396838, 'fit_intercept': False, 'intercept_scaling': 0.5749229111419808}. Best is trial 0 with value: 0.9498355840232581.
score:  0.9577777777777777 balanced_acc:  0.9585567151380063 precision:  0.958678273647547 recall:  0.9585567151380063
(1797, 64)
(1797,)
[32m[I 2024-05-20 19:01:45,480][39m Trial 1 finished with value: 0.9585567151380063 and parameters: {'penality': 'l2', 'solver_l2': 'saga', 'inverse_of_regularization_strength': 0.5067079353785086, 'fit_intercept': True, 'intercept_scaling': 0.7733754159188673}. Best is trial 1 with value: 0.9585567151380063.
/home/anushka/Desktop/take_home/task_1/mlops_env/.pixi/envs/default/lib/python3.12/site-packages/sklearn/linear_model/_logistic.py:1186: UserWarning: Setting penalty=None will ignore the C and l1_ratio parameters
  warnings.warn(
score:  0.9466666666666667 balanced_acc:  0.9475275404120233 precision:  0.9484382370456338 recall:  0.9475275404120233
(1797, 64)
(1797,)
[32m[I 2024-05-20 19:01:48,121][39m Trial 2 finished with value: 0.9475275404120233 and parameters: {'penality': None, 'solver_None': 'newton-cg', 'inverse_of_regularization_strength': 0.9198146762437703, 'fit_intercept': True, 'intercept_scaling': 0.11726959440773246}. Best is trial 1 with value: 0.9585567151380063.
score:  0.9533333333333334 balanced_acc:  0.9542006545319458 precision:  0.9546199638360893 recall:  0.9542006545319458
(1797, 64)
(1797,)
[32m[I 2024-05-20 19:01:50,417][39m Trial 3 finished with value: 0.9542006545319458 and parameters: {'penality': 'l2', 'solver_l2': 'lbfgs', 'inverse_of_regularization_strength': 0.9803993782098854, 'fit_intercept': True, 'intercept_scaling': 0.37988020580537396}. Best is trial 1 with value: 0.9585567151380063.
score:  0.9488888888888889 balanced_acc:  0.9500904030812688 precision:  0.9499416275474715 recall:  0.9500904030812688
Balanced Accuracy: 0.9585567151380063
Best hyperparameters: {'penality': 'l2', 'solver_l2': 'saga', 'inverse_of_regularization_strength': 0.5067079353785086, 'fit_intercept': True, 'intercept_scaling': 0.7733754159188673}
[32m[I 2024-05-20 19:01:53,257][39m Trial 4 finished with value: 0.9500904030812688 and parameters: {'penality': 'l1', 'inverse_of_regularization_strength': 0.32820025276307935, 'fit_intercept': False, 'intercept_scaling': 0.13443707126868554}. Best is trial 1 with value: 0.9585567151380063.